<?xml version="1.0" encoding="UTF-8"?>
<xs:schema xmlns:xs="http://www.w3.org/2001/XMLSchema">
    <xs:element name="menu">
        <xs:complexType>
            <xs:sequence>
                <xs:element name="Primi">
                    <xs:complexType>
                        <xs:sequence>
                            <xs:element name="piatto" maxOccurs="unbounded">
                                <xs:complexType>
                                    <xs:sequence>
                                        <xs:element name="nome" type="xs:string" />
                                        <xs:element name="prezzo" type="xs:decimal" />
                                    </xs:sequence>
                                </xs:complexType>
                            </xs:element>
                        </xs:sequence>
                    </xs:complexType>
                </xs:element>
                <xs:element name="Secondi">
                    <xs:complexType>
                        <xs:sequence>
                            <xs:element name="piatto" maxOccurs="unbounded">
                                <xs:complexType>
                                    <xs:sequence>
                                        <xs:element name="nome" type="xs:string" />
                                        <xs:element name="prezzo" type="xs:decimal" />
                                    </xs:sequence>
                                </xs:complexType>
                            </xs:element>
                        </xs:sequence>
                    </xs:complexType>
                </xs:element>
                <xs:element name="Contorni">
                    <xs:complexType>
                        <xs:sequence>
                            <xs:element name="piatto" maxOccurs="unbounded">
                                <xs:complexType>
                                    <xs:sequence>
                                        <xs:element name="nome" type="xs:string" />
                                        <xs:element name="prezzo" type="xs:decimal" />
                                    </xs:sequence>
                                </xs:complexType>
                            </xs:element>
                        </xs:sequence>
                    </xs:complexType>
                </xs:element>
                <xs:element name="Dessert">
                    <xs:complexType>
                        <xs:sequence>
                            <xs:element name="piatto" maxOccurs="unbounded">
                                <xs:complexType>
                                    <xs:sequence>
                                        <xs:element name="nome" type="xs:string" />
                                        <xs:element name="prezzo" type="xs:decimal" />
                                    </xs:sequence>
                                </xs:complexType>
                            </xs:element>
                        </xs:sequence>
                    </xs:complexType>
                </xs:element>
            </xs:sequence>
        </xs:complexType>
    </xs:element>
</xs:schema>